identifiant;nom_etablissement;numero_siret;adresse;code_postal;commune;departement;region;coordonnees_x;coordonnees_y;code_epsg;code_ape;libelle_ape;code_eprtr;libelle_eprtr
0005401147;Allia Digoin;38957842800028;;71160;DIGOIN;SAONE-ET-LOIRE;BOURGOGNE-FRANCHE-COMTE;729251.460243;2165820.51557;27572;2342Z;Fabrication d'appareils sanitaires en céramique;;
00       22132228;EARL DU HAUT CAINGAN;35056887900018;Le Haut Caingan;22600;LOUDEAC;COTES-D'ARMOR;BRETAGNE;221611;2365251;27572;0146Z;Élevage de porcins;7.(a).(ii);disposant de 2 000 emplacements pour porcs de production (de plus de 30 kg)
0006000537;FONDERIE DUCUIVRE DU PALAIS;41487030300032;49, avenue Aristide Briand;87410;LE PALAIS-SUR-VIENNE;HAUTE-VIENNE;NOUVELLE-AQUITAINE;521601.85519879;2097963.3733913;27572;2444Z;Métallurgie du cuivre;2.(e).(ii);destinées à la fusion, y compris l'alliage, de métaux non ferreux et notamment de produits de récupération (affinage, moulage en fonderie, etc.) d'une capacité de fusion de 4 tonnes par jour pour le plomb et le cadmium ou de 20 tonnes par jour pour tous les autres métaux
0006102886;NALCO France SAS;41494668100130;431 Avenue Ambroise Croizat Zone Industrielle BP 13;38920;CROLLES;ISERE;AUVERGNE-RHONE-ALPES;878771.10730732;2028919.9651967;27572;2059Z;Fabrication d'autres produits chimiques n.c.a.;4.(d);Installations chimiques destinées à la fabrication industrielle de produits phytosanitaires et de biocides
0005503330;HAMEON S.A;31279944800021;;22000;SAINT-BRIEUC;COTES-D'ARMOR;BRETAGNE;630004.87772634;2388934.190614;27572;151E ;Préparation industrielle de produits à base de viandes;;
0005100348;TERGAL INDUSTRIES;39333821500022;Rue Jules Vercruysse;02430;GAUCHY;AISNE;HAUTS-DE-FRANCE;667200.0;2536800.0;27572;2016Z;Fabrication de matières plastiques de base;;
0007001881;MONDELEZ FRANCE;43393576400020;Rue de la Chocolaterie, BP2012;59700;MARCQ-EN-BAROEUL;NORD;HAUTS-DE-FRANCE;705479.000000;7062717.000000;2154;1082Z;Fabrication de cacao, chocolat et de produits de confiserie;;
0007000640;UMICORE;34296500100072;;62100;CALAIS;PAS-DE-CALAIS;HAUTS-DE-FRANCE;564919;2661553;27572;274F ;Production de plomb, de zinc ou d'étain;;
0006700486;GIMFLEX S.A.;49009498400013;;68520;BURNHAUPT-LE-HAUT;HAUT-RHIN;GRAND-EST;960800;2314399;27572;321A ;Fabrication de composants passifs et de condensateurs;;
00       22074024;EARL BAUDOUIN;41210615500010;LORFILLEC;22320;LE HAUT-CORLAY;COTES-D'ARMOR;BRETAGNE;199710;2382616;27572;0147Z;Élevage de volailles;7.(a).(i);disposant de 40 000 emplacements pour la volaille
00       22087263;SCEA YANNICK LE GOFF;39775803800012;Kerfloch;22110;KERGRIST-MOELOU;COTES-D'ARMOR;BRETAGNE;180800;2382899;27572;0146Z;Élevage de porcins;7.(a).(ii);disposant de 2 000 emplacements pour porcs de production (de plus de 30 kg)
0024700107;POLYDEC BOURGOGNE;43945136000028;Zone industrielle de Torcy;71210;TORCY;SAONE-ET-LOIRE;BOURGOGNE-FRANCHE-COMTE;761559;2198494;27572;2223Z;Fabrication d'éléments en matières plastiques pour la construction;;
0006400542;PIERRE DE LOYE - teinturerie;77571442100028;;84830;SERIGNAN-DU-COMTAT;VAUCLUSE;PROVENCE-ALPES-COTE-D'AZUR;800660;1912912;27572;175G ;Industries textiles n.c.a.;;
0005401471;VALLOUREC & MANNESMANN France tuberie de Montbard;65204499100238;BP 130 21502 MONTBARD CEDEX;21502;MONTBARD;COTE-D'OR;BOURGOGNE-FRANCHE-COMTE;750638;2293774;27572;2420Z;Fabrication de tubes, tuyaux, profilés creux et accessoires correspondants en acier;5.(g);Installations autonomes de traitement des eaux industrielles usées provenant d'une ou de plusieurs des activités énumérées dans la présente annexe d'une capacité de 10 000 m3 par jour 
0006401453;MIDI CONSERVES;32177464800026;;84500;BOLLENE;VAUCLUSE;PROVENCE-ALPES-COTE-D'AZUR;792445;1922725;27572;153E ;Transformation et conservation de légumes;;
0006402024;TEMEX;38346149800024;;06904;VALBONNE;ALPES-MARITIMES;PROVENCE-ALPES-COTE-D'AZUR;977094;1860159;27572;321C ;Fabrication de composants électroniques actifs;;
0006204544;ECB - EQUIPEMENT CUISINES BAINS;82715024400016;170 Pont d'Arol BP 99 POUSSAY;88503;MIRECOURT;VOSGES;GRAND-EST;881191.0;2374797.0;27572;3102Z;Fabrication de meubles de cuisine;;
00       75200191;TROENES LOUIS PHILIPPE;37958584700013;BEL ORIENT;56630;LANGONNET;MORBIHAN;BRETAGNE;166161;2361169;27572;0147Z;Élevage de volailles;7.(a).(i);disposant de 40 000 emplacements pour la volaille
00       75200201;COEXPLOITATION CADIO MC;38452128200010;La Ville Abio Le Pron;56220;CADEN;MORBIHAN;BRETAGNE;252800;2302600;27572;0147Z;Élevage de volailles;7.(a).(i);disposant de 40 000 emplacements pour la volaille
00       75200308;COLLET PASCAL;41081253100011;Bel-Air;22600;LA MOTTE;COTES-D'ARMOR;BRETAGNE;223563;2371747;27572;0147Z;Élevage de volailles;7.(a).(i);disposant de 40 000 emplacements pour la volaille
0005701482;BIGARD;77622146700033;ZI SE, rue des Macéliers;51100;REIMS;MARNE;GRAND-EST;723707;2474468;27572;1011Z;Transformation et conservation de la viande de boucherie;8.(a);Abattoirs d'une capacité de production de 50 tonnes de carcasses par jour
0005702603;Knauf Industries;34811246700066;ZI du Canal Terray;10400;NOGENT-SUR-SEINE;AUBE;GRAND-EST;685200.0;2388200.0;27572;2222Z;Fabrication d'emballages en matières plastiques;;
0007001019;Chaufferie de Lille-Hellemmes;48336968200016;;59260;HELESMES;NORD;HAUTS-DE-FRANCE;673037;2596763;27572;3530Z;Production et distribution de vapeur et d'air conditionné;;
0005401050;KRONOSPAN;33890543300136;LE BOIS DE LA DUCHESSE, BP 377;89000;AUXERRE;YONNE;BOURGOGNE-FRANCHE-COMTE;745516.000000;6749071.000000;2154;1621Z;Fabrication de placage et de panneaux de bois;;
0006503218;COFELY;55204695505067;SAIC PARLY II, 2 rue Cimarosa;78150;LE CHESNAY;YVELINES;ILE-DE-FRANCE;635692.000000;6858332.000000;2154;3530Z;Production et distribution de vapeur et d'air conditionné;1.(c);Centrales thermiques et autres installations de combustion avec un apport thermiques de 50 MW
0006000350;TANNERIE MEGISSERIE HERVY;33881669700019;65, route de PERIGUEUX;87170;ISLE;HAUTE-VIENNE;NOUVELLE-AQUITAINE;513638;2089280;27572;1511Z;Apprêt et tannage des cuirs , préparation et teinture des fourrures;;
0006103044;Textiles de Belmont.;31753930200016;Rue du Moulinage;38230;CHAVANOZ;ISERE;AUVERGNE-RHONE-ALPES;820450.0;2090301.0;27572;1396Z;Fabrication d'autres textiles techniques et industriels;9.(c);Installations destinées au traitement de surface de matières, d'objets ou de produits à l'aide de solvants organiques, notamment pour les opérations d'apprêt, d'impression, de revêtement, de dégraissage, d'imperméabilisation, de collage, de peinture, de nettoyage ou d'imprégnation d'une capacité de consommation de 150 kg par heures ou 200 tonnes par an
0006103051;RHODIA plate-forme chimique du Pont de Claix;62203708300087;rue Lavoisier;38800;LE PONT-DE-CLAIX;ISERE;AUVERGNE-RHONE-ALPES;865220.388;2019258.365;27572;2013B;Fabrication d'autres produits chimiques inorganiques de base n.c.a.;;
0006103280;HERCULES SA;30098352500068;ZONE INDUSTRIELLE;38340;VOREPPE;ISERE;AUVERGNE-RHONE-ALPES;857085.0;2039410.0;27572;2059Z;Fabrication d'autres produits chimiques n.c.a.;4.(a).(xi);tensioactifs et agents de surface
0006104424;MERLIN GERIN ALPES;49327913700027;ZI Alpespace Voie Isaac Newton;73800;FRANCIN;SAVOIE;AUVERGNE-RHONE-ALPES;888738;2062170;27572;2790Z;Fabrication d'autres matériels électriques;;
0006104736;T2R;43765823000010;275 rue de la Poste ZI Les Pochons;74300;THYEZ;HAUTE-SAVOIE;AUVERGNE-RHONE-ALPES;923800.0;2128400.0;27572;2561Z;Traitement et revêtement des métaux;2.(f);Installations de traitement de surface de métaux et des matières plastiques utilisant un procédé électrolytique ou chimique lorsque le volume des cuves affectées au traitement est égal à 30 m3
0007000800;MERYL FIBER;39036238200033;Avenue de l'Ermitage BP 60089;62053;SAINT-LAURENT-BLANGY;PAS-DE-CALAIS;HAUTS-DE-FRANCE;633200;2589500;27572;2060Z;Fabrication de fibres artificielles ou synthétiques;;
0006104763;Savoie Chrome Dur Services;41045223900016;4 rue des Chasseurs - Zone Industrielle Montréal;74100;VILLE-LA-GRAND;HAUTE-SAVOIE;AUVERGNE-RHONE-ALPES;904534.0;2141719.0;27572;2561Z;Traitement et revêtement des métaux;2.(f);Installations de traitement de surface de métaux et des matières plastiques utilisant un procédé électrolytique ou chimique lorsque le volume des cuves affectées au traitement est égal à 30 m3
0006501585;CACI;77565811500073;ZI Nord rue de la Bauve;77100;MEAUX;SEINE-ET-MARNE;ILE-DE-FRANCE;639447;2440036;27572;2041Z;Fabrication de savons, détergents et produits d'entretien;;
0007002543;ARDO VIOLAINES SAS;41487961900016;;62138;VIOLAINES;PAS-DE-CALAIS;HAUTS-DE-FRANCE;631862.0;2317314.0;27572;153E ;Transformation et conservation de légumes;;
0007000864;TECHNIQUES LEROY;31503095700015;ZONE INDUSTRIELLE - 6 ROUTE DE CAMBRAI;62452;BAPAUME;PAS-DE-CALAIS;HAUTS-DE-FRANCE;636893;2567474;27572;2561Z;Traitement et revêtement des métaux;2.(f);Installations de traitement de surface de métaux et des matières plastiques utilisant un procédé électrolytique ou chimique lorsque le volume des cuves affectées au traitement est égal à 30 m3
0006202456;BODYCOTE site de Saint Dié;69678042800095;86 RUE DES 4 FRERES MOUGEOTTE;88100;SAINT-DIE;VOSGES;GRAND-EST;948669.209;2371634.456;27572;2561Z;Traitement et revêtement des métaux;2.(f);Installations de traitement de surface de métaux et des matières plastiques utilisant un procédé électrolytique ou chimique lorsque le volume des cuves affectées au traitement est égal à 30 m3
0006205703;SOVOS Tannerie Grosjean;30635053900012;21 Rue des Tanneries;88160;LE THILLOT;VOSGES;GRAND-EST;931052;2329406;27572;1511Z;Apprêt et tannage des cuirs , préparation et teinture des fourrures;;
0006301376;CEREXAGRI;56980498200324;Zone Industrielle;72500;VAAS;SARTHE;PAYS-DE-LA-LOIRE;448411;2298489;27572;2020Z;Fabrication de pesticides et d'autres produits agrochimiques;;
00       75200007;BALLIS SA;31490197600014;LES FOSSES;85140;L'OIE;VENDEE;PAYS-DE-LA-LOIRE;335571;2205563;27572;0147Z;Élevage de volailles;7.(a).(i);disposant de 40 000 emplacements pour la volaille
0006400983;COOPERATIVE AGRICOLE DE BERRE;78270787100011;Voie Jean Pierre Lyon;13130;BERRE-L'ETANG;BOUCHES-DU-RHONE;PROVENCE-ALPES-COTE-D'AZUR;831074.55715987;1841061.0497468;27572;4675Z;Commerce de gros (commerce interentreprises) de produits chimiques;;
0006500188;SUN CHEMICAL C2E;60822974600078;11, RUE DU COQ GAULOIS;77170;BRIE-COMTE-ROBERT;SEINE-ET-MARNE;ILE-DE-FRANCE;620155.0;2410643.0;27572;2030Z;Fabrication de peintures, vernis, encres et mastics;;
0006700354;SRF;31774800200019;3, avenue Nessel;68570;SOULTZMATT;HAUT-RHIN;GRAND-EST;965894;2340538;27572;2453Z;Fonderie de métaux légers;2.(e).(ii);destinées à la fusion, y compris l'alliage, de métaux non ferreux et notamment de produits de récupération (affinage, moulage en fonderie, etc.) d'une capacité de fusion de 4 tonnes par jour pour le plomb et le cadmium ou de 20 tonnes par jour pour tous les autres métaux
0006700752;TRESCH CLERGET SAS;50157067500022;1, avenue de Hollande;68110;ILLZACH;HAUT-RHIN;GRAND-EST;973981.60321256;2320831.965941;27572;4634Z;Commerce de gros (commerce interentreprises) de boissons;;
0007000097;SOFANOR;49076834800016;94 Rue Valériani;59920;QUIEVRECHAIN;NORD;HAUTS-DE-FRANCE;694712;2601653;27572;3020Z;Construction de locomotives et d'autre matériel ferroviaire roulant;;
00       75200019;Gaec la guilbaudiere;81278588900013;LA GUILBAUDIERE;85300;FROIDFOND;VENDEE;PAYS-DE-LA-LOIRE;287948;2215800;27572;0147Z;Élevage de volailles;7.(a).(i);disposant de 40 000 emplacements pour la volaille
0005701095;BARET;78632024200013;156 rue saint louis;08170;HAYBES;ARDENNES;GRAND-EST;4.698962;49.996633;4326;1610B;Imprégnation du bois;6.(c);Installations industrielles destinées à la conservation du bois et des produits dérivés du bois au moyen de substances chimiques d'une capacité de production de 50 m3 par jour 
0007000966;FTS;34140064500020;;62000;ARRAS;PAS-DE-CALAIS;HAUTS-DE-FRANCE;630256;2588278;27572;285A ;Traitement et revêtement des métaux;;
0007000671;ARKEMA - usine de Loison sous Lens -;31963279000493;121 route de Lille;62218;LOISON-SOUS-LENS;PAS-DE-CALAIS;HAUTS-DE-FRANCE;636800;2605400;27572;5210B;Entreposage et stockage non frigorifique;4.(a).(ii);hydrocarbures oxygénés, notamment les alcools, aldéhydes, cétones, acides carboxyliques, esters, acétates, éthers, peroxydes, résines époxydes
0007001008;Chaufferie de Longchamp;45650053700018;Rue Léon Blum;59390;LYS-LEZ-LANNOY;NORD;HAUTS-DE-FRANCE;662856;2630648;27572;3530Z;Production et distribution de vapeur et d'air conditionné;;
0007000722;ROZENDAAL;77562513000015;85, rue Saint-Charles - BP 228;59110;LA MADELEINE;NORD;HAUTS-DE-FRANCE;651868.05430616;2630233.729386;27572;4676Z;Commerce de gros (commerce interentreprises) d'autres produits intermédiaires;9.(a);Usines destinées au prétraitement (opérations de lavage, de blanchiment, de mercerisation) ou à la teinture de fibres ou de textiles d'une capacité de traitement de 10 tonnes par jour
0006202392;FENIIX;84102245200012;9001 Chemin de Romont;88700;RAMBERVILLERS;VOSGES;GRAND-EST;968240.000000;6812257.000000;2154;3821Z;Traitement et élimination des déchets non dangereux;5.(b);Installations destinées à l'incinération des déchets non dangereux dans le cadre de la directive 2000/76/CE du Parlement européen et du Conseil du 4 décembre 2000 sur l'incinération des déchets d'une capacité de 3 tonnes par heure
0005101211;STORENGY;48765063200044;Hameau de Saint Maur;60190;GOURNAY-SUR-ARONDE;OISE;HAUTS-DE-FRANCE;678200.000000;6936500.000000;2154;5210B;Entreposage et stockage non frigorifique;1.(c);Centrales thermiques et autres installations de combustion avec un apport thermiques de 50 MW
0006102824;VICAT;05750553900452;Usine de Montalieu, BP 14;38390;BOUVESSE-QUIRIEU;ISERE;AUVERGNE-RHONE-ALPES;887768.000000;6525733.000000;2154;2351Z;Fabrication de ciment;3.(c).(i);de clinker (ciment) dans des fours rotatifs d'une capacité de production de 500 tonnes par jour
0007001091;LAMATO;47814058500025;Avenue de l'Ermitage;62053;SAINT-LAURENT-BLANGY;PAS-DE-CALAIS;HAUTS-DE-FRANCE;633200;2589500;27572;2060Z;Fabrication de fibres artificielles ou synthétiques;;
0010001592;U I O M de Pithiviers;66203217600155;Route de Bouzonville en Beauce;45300;PITHIVIERS;LOIRET;CENTRE;592789.0;2354235.0;27572;3821Z;Traitement et élimination des déchets non dangereux;5.(b);Installations destinées à l'incinération des déchets non dangereux dans le cadre de la directive 2000/76/CE du Parlement européen et du Conseil du 4 décembre 2000 sur l'incinération des déchets d'une capacité de 3 tonnes par heure
0010001760;THYSSEN KRUPP SOFEDIT VENDOME;44378278400021;8 RUE MARC SEGUIN;41100;VENDOME;LOIR-ET-CHER;CENTRE;504579;2311200;27572;2932Z;Fabrication d'autres équipements automobiles;;
0024900045;COVED - ISDND de Villiers;34340353101983;*;89110;VILLIERS-SUR-THOLON;YONNE;BOURGOGNE-FRANCHE-COMTE;674911;2321270;27572;3821Z;Traitement et élimination des déchets non dangereux;;
0005101373;ZF sachs suspension France SAS;33804793900032;Allée markam- BP 50153;60251;MOUY;OISE;HAUTS-DE-FRANCE;599003.0;2480443.0;27572;2932Z;Fabrication d'autres équipements automobiles;2.(f);Installations de traitement de surface de métaux et des matières plastiques utilisant un procédé électrolytique ou chimique lorsque le volume des cuves affectées au traitement est égal à 30 m3
0005103810;Flexico Minigrip Etablissement d'Hénonville;44029668900019;1 route de Méru - BP 70 429 Hénonville;60119;HENONVILLE;OISE;HAUTS-DE-FRANCE;579540;2467803;27572;2222Z;Fabrication d'emballages en matières plastiques;;
0005201954;Centre de Pécorade;40916013200026;128 Chem Campiston;40320;SORBETS;LANDES;NOUVELLE-AQUITAINE;382250.0;1853500.0;27572;0620Z;Extraction de gaz naturel;;
0005401041;EXIDE TECHNOLOGIE SAS;68203089500242;57 avenue Jean Mermoz;89000;AUXERRE;YONNE;BOURGOGNE-FRANCHE-COMTE;693417.0;2313749.0;27572;2720Z;Fabrication de piles et d'accumulateurs électriques;2.(e).(ii);destinées à la fusion, y compris l'alliage, de métaux non ferreux et notamment de produits de récupération (affinage, moulage en fonderie, etc.) d'une capacité de fusion de 4 tonnes par jour pour le plomb et le cadmium ou de 20 tonnes par jour pour tous les autres métaux
0005500127;ELCI;49877808300010;Avenue Pierre Marzin;22307;LANNION;COTES-D'ARMOR;BRETAGNE;173434;2430606;27572;2611Z;Fabrication de composants électroniques;2.(f);Installations de traitement de surface de métaux et des matières plastiques utilisant un procédé électrolytique ou chimique lorsque le volume des cuves affectées au traitement est égal à 30 m3
0005501393;FAURECIA INDUSTRIE;42087914000101;Parc d'activité de Ferchaud;35320;CREVIN;ILLE-ET-VILAINE;BRETAGNE;301100;2334000;27572;2932Z;Fabrication d'autres équipements automobiles;;
0005701085;ARDENITY;37973996400011;Route de philippeville;08600;GIVET;ARDENNES;GRAND-EST;778249;2573950;27572;2014Z;Fabrication d'autres produits chimiques organiques de base;;
0005701491;OI MANUFACTURING France - Usine de REIMS FOOD;33578213200013;41 rue Pierre MAITRE;51100;REIMS;MARNE;GRAND-EST;720857.04907841;2475263.8855534;27572;2313Z;Fabrication de verre creux;3.(e);Installations destinées à la fabrication du verre, y compris de fibres de verre d'une capacité de fusion de 20 tonnes par jour
0005800492;CITRON SA;40913686800026;Port 1341 BP 51;76700;ROGERVILLE;SEINE-MARITIME;NORMANDIE;450188;2502648;27572;3822Z;Traitement et élimination des déchets dangereux;5.(a);Installations pour la valorisation ou l'élimination des déchets dangereux recevant 10 tonnes par jour
0006102001;Scapa Bellegarde;39163683400031;19 Rue de Savoie;01201;BELLEGARDE-SUR-VALSERINE;AIN;AUVERGNE-RHONE-ALPES;869644.0;2128708.0;27572;2219Z;Fabrication d'autres articles en caoutchouc;9.(c);Installations destinées au traitement de surface de matières, d'objets ou de produits à l'aide de solvants organiques, notamment pour les opérations d'apprêt, d'impression, de revêtement, de dégraissage, d'imperméabilisation, de collage, de peinture, de nettoyage ou d'imprégnation d'une capacité de consommation de 150 kg par heures ou 200 tonnes par an
0006104364;OCV CHAMBERY (Usine C);30988081300022;130 avenue des Follaz BP928;73009;CHAMBERY;SAVOIE;AUVERGNE-RHONE-ALPES;878381.0;2070684.0;27572;2314Z;Fabrication de fibres de verre;3.(e);Installations destinées à la fabrication du verre, y compris de fibres de verre d'une capacité de fusion de 20 tonnes par jour
0006104668;SURF;30919173200010;L'Eculaz;74930;REIGNIER;HAUTE-SAVOIE;AUVERGNE-RHONE-ALPES;905934.0;2133344.0;27572;2561Z;Traitement et revêtement des métaux;2.(f);Installations de traitement de surface de métaux et des matières plastiques utilisant un procédé électrolytique ou chimique lorsque le volume des cuves affectées au traitement est égal à 30 m3
0006200936;CAFAC BAJOLET;45339192200029;ZI de Chicago;55100;VERDUN;MEUSE;GRAND-EST;821410.0;2467121.0;27572;2219Z;Fabrication d'autres articles en caoutchouc;;
0006202493;GREGOIRE SA;39876679000016;MOULIN SAINT NABORD BP 114;88204;REMIREMONT;VOSGES;GRAND-EST;916220.0;2344970.0;27572;1712Z;Fabrication de papier et de carton;6.(b);Installations industrielles destinées à la fabrication de papier et de carton et d'autres produits dérivés du bois (tels que l'aggloméré, les panneaux de fibres de bois et le contreplaqué) d'une capacité de production de 20 tonnes par jour
0006400538;MALAUCENE INDUSTRIES;39931179400024;Route du mont Ventoux;84340;MALAUCENE;VAUCLUSE;PROVENCE-ALPES-COTE-D'AZUR;826448.485;1913191.587;27572;1712Z;Fabrication de papier et de carton;9.(c);Installations destinées au traitement de surface de matières, d'objets ou de produits à l'aide de solvants organiques, notamment pour les opérations d'apprêt, d'impression, de revêtement, de dégraissage, d'imperméabilisation, de collage, de peinture, de nettoyage ou d'imprégnation d'une capacité de consommation de 150 kg par heures ou 200 tonnes par an
0006400897;PAPETERIES ETIENNE;37572020800012;29 avenue de Camargue;13200;ARLES;BOUCHES-DU-RHONE;PROVENCE-ALPES-COTE-D'AZUR;785465.775;1854360.391;27572;1712Z;Fabrication de papier et de carton;6.(b);Installations industrielles destinées à la fabrication de papier et de carton et d'autres produits dérivés du bois (tels que l'aggloméré, les panneaux de fibres de bois et le contreplaqué) d'une capacité de production de 20 tonnes par jour
0006400989;Basell Fos SAS;33505078700076;Z.I. La Feuillane BP 30020;13771;FOS-SUR-MER;BOUCHES-DU-RHONE;PROVENCE-ALPES-COTE-D'AZUR;806200.0;1833800.0;27572;2016Z;Fabrication de matières plastiques de base;;
0006600250;SLMC;54207668200039;Z.I. de Malvezy Route de Moussan;11100;NARBONNE;AUDE;OCCITANIE;651505.39940091;1801484.5441996;27572;2012Z;Fabrication de colorants et de pigments;4.(a).(x);colorants et pigments
0006700501;Pascual Jus de Fruits;49829404000015;BP 9 10, rue Cidou;67580;MIETESHEIM;BAS-RHIN;GRAND-EST;989186;2444236;27572;1032Z;Préparation de jus de fruits et légumes;8.(b).(i);matières premières animales (autres que le lait) d'une capacité de production de produits finis de 75 tonnes par jour
0006700565;ROENFANZ-MARTZOLFF;67578038100017;16 rue de Hohengoeft;67310;WASSELONNE;BAS-RHIN;GRAND-EST;976500;2416499;27572;2561Z;Traitement et revêtement des métaux;2.(f);Installations de traitement de surface de métaux et des matières plastiques utilisant un procédé électrolytique ou chimique lorsque le volume des cuves affectées au traitement est égal à 30 m3
0005104803;CLAL-FRANCE;40072351600029;11 rue du Ménillet;60540;BORNEL;OISE;HAUTS-DE-FRANCE;590759;2466600;27572;2444Z;Métallurgie du cuivre;2.(e).(ii);destinées à la fusion, y compris l'alliage, de métaux non ferreux et notamment de produits de récupération (affinage, moulage en fonderie, etc.) d'une capacité de fusion de 4 tonnes par jour pour le plomb et le cadmium ou de 20 tonnes par jour pour tous les autres métaux
0005501710;SIFDDA Bretagne;40326475700028;les vaux;56380;GUER;MORBIHAN;BRETAGNE;266838;2332285;27572;3832Z;Récupération de déchets triés;5.(e);Installations destinées à l'élimination ou à la valorisation de carcasses et de déchets d'animaux d'une capacité de traitement de 10 tonnes par jour
0005500307;CHAFFOTEAUX site de Ploufragan;39916141300055;ZI DES Châtelets;22440;PLOUFRAGAN;COTES-D'ARMOR;BRETAGNE;220333;2400572;27572;6430Z;Fonds de placement et entités financières similaires;;
0005701681;GRANDECO WALLFASHION GROUP N.V.;49909860600027;7, rue AMPERE BP 540;51012;CHALONS-SUR-MARNE;MARNE;GRAND-EST;748493;2441748;27572;1724Z;Fabrication de papiers peints;;
0005702104;ASSAABLOY AUBE ANJOU;55205267200078;Rue de la paix;10000;TROYES;AUBE;GRAND-EST;728919;2368490;27572;2572Z;Fabrication de serrures et de ferrures;;
0005800348;ExxonMobil Chemical France;35217001300028;Avenue du Président Kennedy, BP 52;76330;NOTRE-DAME-DE-GRAVENCHON;SEINE-MARITIME;NORMANDIE;522200.000000;6933730.000000;2154;2014Z;Fabrication d'autres produits chimiques organiques de base;4.(a).(i);hydrocarbures simples (linéaires ou cycliques, saturés ou insaturés, aliphatiques ou aromatiques)
0005800698;Cooper Standard Automotive;38979892700064;Hameau de la Station 64 avenue Louis Debray;76210;BOLBEC;SEINE-MARITIME;NORMANDIE;465000;2509800;27572;2219Z;Fabrication d'autres articles en caoutchouc;;
0005801260;centre de traitement des déchets;50945421100087;Chemin de la rivière;76370;ROUXMESNIL-BOUTEILLES;SEINE-MARITIME;NORMANDIE;510548;2546063;27572;3821Z;Traitement et élimination des déchets non dangereux;5.(b);Installations destinées à l'incinération des déchets non dangereux dans le cadre de la directive 2000/76/CE du Parlement européen et du Conseil du 4 décembre 2000 sur l'incinération des déchets d'une capacité de 3 tonnes par heure
0007000922;VENATOR (Ex Huntsman P&A France);65175003600014;1, Rue des Garennes, B.P. 89;62100;CALAIS;PAS-DE-CALAIS;HAUTS-DE-FRANCE;621327.000000;7097330.000000;2154;2012Z;Fabrication de colorants et de pigments;4.(a).(x);colorants et pigments
0006200537;Dr FISCHER EUROPE;50143166200011;rue de Montrichard;54700;PONT-A-MOUSSON;MEURTHE-ET-MOSELLE;GRAND-EST;872257;2439988;27572;2740Z;Fabrication d'appareils d'éclairage électrique;;
0006302129;UIOM de La Roseraie;24490001500037;36 bis, Boulevard d'Arbrissel;49130;SAINTE-GEMMES-SUR-LOIRE;MAINE-ET-LOIRE;PAYS-DE-LA-LOIRE;381729;2273536;27572;8411Z;Administration publique générale;5.(b);Installations destinées à l'incinération des déchets non dangereux dans le cadre de la directive 2000/76/CE du Parlement européen et du Conseil du 4 décembre 2000 sur l'incinération des déchets d'une capacité de 3 tonnes par heure
0006401829;LEGRAND;75850100100260;ZI les 3 moulins - 159, rue Jean Joannon;06600;ANTIBES;ALPES-MARITIMES;PROVENCE-ALPES-COTE-D'AZUR;986540;1853745;27572;2712Z;Fabrication de matériel de distribution et de commande électrique;;
00       75200297;SCEA LEVANT;50507072200010;Soleil Levant;22400;HENANSAL;COTES-D'ARMOR;BRETAGNE;247856;2404281;27572;0147Z;Élevage de volailles;7.(a).(i);disposant de 40 000 emplacements pour la volaille
0007202957;PAPETERIES DE VEUZE;39982356600019;B.P. 80103;16600;MAGNAC-SUR-TOUVRE;CHARENTE;NOUVELLE-AQUITAINE;436548;2075963;27572;1712Z;Fabrication de papier et de carton;6.(b);Installations industrielles destinées à la fabrication de papier et de carton et d'autres produits dérivés du bois (tels que l'aggloméré, les panneaux de fibres de bois et le contreplaqué) d'une capacité de production de 20 tonnes par jour
0005401759;FABINOV;52903354000020;40 ROUTE DE VEZELAY;89460;BAZARNES;YONNE;BOURGOGNE-FRANCHE-COMTE;699749;2296474;27572;3109B;Fabrication d'autres meubles et industries connexes de l'ameublement;;
