identifiant;nom_etablissement;numero_siret;adresse;code_postal;commune;departement;region;coordonnees_x;coordonnees_y;code_epsg;code_ape;libelle_ape;code_eprtr;libelle_eprtr
0006301829;GRT GAZ Station de Cherré;44011762001530;Stations de Compression et d'interconnexion;72400;CHERRE;SARTHE;PAYS-DE-LA-LOIRE;524590.000000;6784521.000000;2154;4950Z;Transports par conduites;;
0006302121;AMCOR FLEXIBLES MONTREUIL BELLAY SAS;34982189200024;ZI de l'Europe, Rue des Ammonites;49260;MONTREUIL-BELLAY;MAINE-ET-LOIRE;PAYS-DE-LA-LOIRE;462118.000000;6673987.000000;2154;1721C;Fabrication d'emballages en papier;9.(c);Installations destinées au traitement de surface de matières, d'objets ou de produits à l'aide de solvants organiques, notamment pour les opérations d'apprêt, d'impression, de revêtement, de dégraissage, d'imperméabilisation, de collage, de peinture, de nettoyage ou d'imprégnation d'une capacité de consommation de 150 kg par heures ou 200 tonnes par an
0006302371;PRODIA OUEST;37943703100022;Les Hauteurs, BP 22 - STE FLORENCE;85140;SAINTE-FLORENCE;VENDEE;PAYS-DE-LA-LOIRE;384067.000000;6641532.000000;2154;1092Z;Fabrication d'aliments pour animaux de compagnie;8.(b).(i);matières premières animales (autres que le lait) d'une capacité de production de produits finis de 75 tonnes par jour
0006303118;AFFINERIE D'ANJOU;37846964700010;Le Piqueron, Linières Bouton;49490;NOYANT;MAINE-ET-LOIRE;PAYS-DE-LA-LOIRE;480284.000000;6710339.000000;2154;2442Z;Métallurgie de l'aluminium;2.(e).(ii);destinées à la fusion, y compris l'alliage, de métaux non ferreux et notamment de produits de récupération (affinage, moulage en fonderie, etc.) d'une capacité de fusion de 4 tonnes par jour pour le plomb et le cadmium ou de 20 tonnes par jour pour tous les autres métaux
0006400007;APEE;53386034200013;ZUP Encagnane, 43 avenue Jean Giono;13090;AIX-EN-PROVENCE;BOUCHES-DU-RHONE;PROVENCE-ALPES-COTE-D'AZUR;896739.000000;6271759.000000;2154;3530Z;Production et distribution de vapeur et d'air conditionné;;
0006400340;TOURNAIRE;41555011000019;Z.I. du Plan de Grasse, 50, route de Paoute  - BP 71004;06130;GRASSE;ALPES-MARITIMES;PROVENCE-ALPES-COTE-D'AZUR;1019112.000000;6290128.000000;2154;2592Z;Fabrication d'emballages métalliques légers;2.(f);Installations de traitement de surface de métaux et des matières plastiques utilisant un procédé électrolytique ou chimique lorsque le volume des cuves affectées au traitement est égal à 30 m3
0006400353;LA MESTA SAS;97080272400017;1336, Route de l'Esteron;06830;GILETTE;ALPES-MARITIMES;PROVENCE-ALPES-COTE-D'AZUR;1036237.000000;6312210.000000;2154;2014Z;Fabrication d'autres produits chimiques organiques de base;4.(a).(ii);hydrocarbures oxygénés, notamment les alcools, aldéhydes, cétones, acides carboxyliques, esters, acétates, éthers, peroxydes, résines époxydes
0006400568;VALSUD;41029972100085;Agence de Septemes, Chemin du vallon d'Ol - La Montagne;13240;SEPTEMES-LES-VALLONS;BOUCHES-DU-RHONE;PROVENCE-ALPES-COTE-D'AZUR;893720.000000;6256982.000000;2154;3821Z;Traitement et élimination des déchets non dangereux;5.(d);Décharges, à l'exception des décharges de déchets inertes et des décharges qui ont été définitivement fermées avant le 16 juillet 2001 ou dont la phase de gestion après désaffection requise par les autorités compétentes conformément à l'article 13 de la directive 1999/31/CE du Conseil du 26 avril 1999 concernant la mise en décharge des déchets s'est achevée recevant 10 tonnes par jour ou d'une capacité totale de 25 000 tonnes
0006400997;LYONDELL CHIMIE France SAS;33383456200022;BP 80201- ZIP de Fos/Caban - Route du Quai Minéralier;13270;FOS-SUR-MER;BOUCHES-DU-RHONE;PROVENCE-ALPES-COTE-D'AZUR;802711.041000;1827084.994000;27572;2014Z;Fabrication d'autres produits chimiques organiques de base;4.(a).(ii);hydrocarbures oxygénés, notamment les alcools, aldéhydes, cétones, acides carboxyliques, esters, acétates, éthers, peroxydes, résines époxydes
0006501132;Storengy;48765063200036;LIEU-DIT LA TUILERIE - LES PLATRIERES;77840;GERMIGNY-SOUS-COULOMBS;SEINE-ET-MARNE;ILE-DE-FRANCE;712768.000000;6884168.000000;2154;5210B;Entreposage et stockage non frigorifique;;
0006501602;BASF Health and Care Product France;54678006500027;19, rue Pierre Brasseur, ZA;77100;MEAUX;SEINE-ET-MARNE;ILE-DE-FRANCE;694601.000000;6871898.000000;2154;2014Z;Fabrication d'autres produits chimiques organiques de base;4.(a).(xi);tensioactifs et agents de surface
0006504212;DALKIA Grand Paris Sud Energie Positive;79802623300055;1 Ave de la Liberté;91000;EVRY;ESSONNE;ILE-DE-FRANCE;658381.000000;6837469.000000;2154;3530Z;Production et distribution de vapeur et d'air conditionné;1.(c);Centrales thermiques et autres installations de combustion avec un apport thermiques de 50 MW
0006506288;TOTAL MARKETING FRANCE;53168044502475;23 A 25 ROUTE DE LA SEINE;92230;GENNEVILLIERS;HAUTS-DE-SEINE;ILE-DE-FRANCE;2.276742;48.946365;4326;4671Z;Commerce de gros (commerce interentreprises) de combustibles et de produits annexes;;
0006506514;IVRY PARIS 13;52142762500020;43 RUE BRUNESEAU, ENTREE PARIS XIII 75013 PARIS;94200;IVRY-SUR-SEINE;VAL-DE-MARNE;ILE-DE-FRANCE;655072.000000;6858204.000000;2154;3821Z;Traitement et élimination des déchets non dangereux;5.(b);Installations destinées à l'incinération des déchets non dangereux dans le cadre de la directive 2000/76/CE du Parlement européen et du Conseil du 4 décembre 2000 sur l'incinération des déchets d'une capacité de 3 tonnes par heure
0005401158;COMECA Equipements Basse Tension;38919141200029;;71880;CHATENOY-LE-ROYAL;SAONE-ET-LOIRE;BOURGOGNE-FRANCHE-COMTE;788994.0;2202145.0;27572;2733Z;Fabrication de matériel d'installation électrique;;
0005401238;OXXO menuiseries;68545036300047;;71250;CLUNY;SAONE-ET-LOIRE;BOURGOGNE-FRANCHE-COMTE;778400;2161910;27572;4332A;Travaux de menuiserie bois et pvc;;
0010700150;OCV CHAMBERY(Usine B);30988081300022;130 avenue des Follaz BP928;73000;CHAMBERY;SAVOIE;AUVERGNE-RHONE-ALPES;878741.0;2071040.0;27572;2314Z;Fabrication de fibres de verre;3.(e);Installations destinées à la fabrication du verre, y compris de fibres de verre d'une capacité de fusion de 20 tonnes par jour
0005102272;SARL R.MOREL;31576686500036;;80220;GAMACHES;SOMME;HAUTS-DE-FRANCE;543900;2554800;27572;261E ;Fabrication de verre creux;;
0006401740;FIRMENICH SEILLANS;33961249100060;543, Route de la Parfumerie;83440;SEILLANS;VAR;PROVENCE-ALPES-COTE-D'AZUR;947879;1857810;27572;2053Z;Fabrication d'huiles essentielles;;
0006401211;CHROMALU;38009811100020;ZAC DES PLAYES JEAN MONNET, 290 chemin de la Farlède;83500;LA SEYNE-SUR-MER;VAR;PROVENCE-ALPES-COTE-D'AZUR;888750;1795946;27572;2561Z;Traitement et revêtement des métaux;2.(f);Installations de traitement de surface de métaux et des matières plastiques utilisant un procédé électrolytique ou chimique lorsque le volume des cuves affectées au traitement est égal à 30 m3
0005100478;SITCR;40877786000011;;02100;SAINT-QUENTIN;AISNE;HAUTS-DE-FRANCE;671116.94276694;2541785.1651629;27572;173Z ;Ennoblissement textile;;
0006601003;GDH (GESTION DE DEPOTS D'HYDROCARBURES);38374297000031;Avenue de la Méditerranée;34110;FRONTIGNAN;HERAULT;OCCITANIE;761074.000000;6259495.000000;2154;4671Z;Commerce de gros (commerce interentreprises) de combustibles et de produits annexes;;
0006700612;LILLY FRANCE;60984915300042;2, rue du Colonel Lilly;67640;FEGERSHEIM;BAS-RHIN;GRAND-EST;1046630.000000;6832902.000000;2154;2120Z;Fabrication de préparations pharmaceutiques;;
0006700639;FEDERAL MOGUL VALVETRAIN (ex TRW);44025815000034;31 RUE DES FORGES;67130;SCHIRMECK;BAS-RHIN;GRAND-EST;1012131.000000;6828898.000000;2154;2811Z;Fabrication de moteurs et turbines, à l'exception des moteurs d'avions et de véhicules;;
0006700644;JEDELE TRAITEMENTS DE SURFACE;50110232100012;6 rue Alfred Jédelé, ZI GARE    BP 20108;68130;ALTKIRCH;HAUT-RHIN;GRAND-EST;1017530.000000;6733496.000000;2154;2561Z;Traitement et revêtement des métaux;2.(f);Installations de traitement de surface de métaux et des matières plastiques utilisant un procédé électrolytique ou chimique lorsque le volume des cuves affectées au traitement est égal à 30 m3
0006702299;TRANSPORTS KLEIN;91622085800028;60 ROUTE DE KINTZHEIM;67600;SELESTAT;BAS-RHIN;GRAND-EST;1028290.000000;6804403.000000;2154;4941A;Transports routiers de fret interurbains;;
0007000504;EDF Direction Production Ingénierie -;55208131760012;476 allée de la vigilence;59111;BOUCHAIN;NORD;HAUTS-DE-FRANCE;722471.000000;7022278.000000;2154;3511Z;Production d'électricité;1.(c);Centrales thermiques et autres installations de combustion avec un apport thermiques de 50 MW
0007000581;ASTRAZENECA DUNKERQUE PRODUCTION;44813963400019;224 avenue de la Dordogne;59140;DUNKERQUE;NORD;HAUTS-DE-FRANCE;654138.000000;7101863.000000;2154;2014Z;Fabrication d'autres produits chimiques organiques de base;;
0007000658;TEREOS France;53324797900099;Rue d'Erre, BP 1;59161;ESCAUDOEUVRES;NORD;HAUTS-DE-FRANCE;718134.000000;7010685.000000;2154;1081Z;Fabrication de sucre;8.(b).(ii);matières premières végétales d'une capacité de production de produits finis de 300 tonnes par jour (valeur moyenne sur une base trimestrielle)
0007000749;REFINAL INDUSTRIES;41381685100088;rue Pelouze, CS 40902;59465;LILLE;NORD;HAUTS-DE-FRANCE;705194.000000;7059160.000000;2154;3832Z;Récupération de déchets triés;2.(e).(ii);destinées à la fusion, y compris l'alliage, de métaux non ferreux et notamment de produits de récupération (affinage, moulage en fonderie, etc.) d'une capacité de fusion de 4 tonnes par jour pour le plomb et le cadmium ou de 20 tonnes par jour pour tous les autres métaux
0007000956;ARCELORMITTAL FRANCE;56209442500468;Port 3031 - 3031 Rue du Comte Jean, CS 52508 - Grande-Synthe;59381;DUNKERQUE;NORD;HAUTS-DE-FRANCE;650301.000000;7105130.000000;2154;2410Z;Sidérurgie;2.(c).(i);par laminage à chaud d'une capacité de 20 t d'acier brut par heure
0007000987;VENATOR Pigments France;40322731700019;203, route de Wervicq, BP 50017;59559;COMINES;NORD;HAUTS-DE-FRANCE;701068.000000;7071969.000000;2154;2012Z;Fabrication de colorants et de pigments;4.(a).(x);colorants et pigments
0010000980;CIRETEC;33873132600025;1, rue Jean Monnet, ZA;45130;SAINT-AY;LOIRET;CENTRE;556715.000000;2318541.000000;27572;2611Z;Fabrication de composants électroniques;;
0010002253;Etablissement de PITHIVIERS LE VIEIL;42134336900235;1 rue Etienne Rochette;45300;PITHIVIERS-LE-VIEIL;LOIRET;CENTRE;643238.770000;6785581.480000;2154;1081Z;Fabrication de sucre;8.(b).(ii);matières premières végétales d'une capacité de production de produits finis de 300 tonnes par jour (valeur moyenne sur une base trimestrielle)
0005102088;Le JERSEY de PARIS;38009819400042;;80800;CORBIE;SOMME;HAUTS-DE-FRANCE;612512;2545563;27572;171F ;Filature de l'industrie lainière - cycle peigné;;
0005503773;MANE LYRAZ;41555028400053;;56530;QUEVEN;MORBIHAN;BRETAGNE;168786.0;2326050.0;27572;1089Z;Fabrication d'autres produits alimentaires n.c.a.;;
0007002729;BARDUSCH - TBN FontaineND;68552004100011;ZI Cantimpré, Avenue de l'Europe;59341;CAMBRAI;NORD;HAUTS-DE-FRANCE;714088.000000;7008402.000000;2154;9601A;Blanchisserie-teinturerie de gros;;
0006401027;DEPOT PETROLIER DE FOS;63718088600011;ZI secteur 81 AUDIENCE 818;13270;FOS-SUR-MER;BOUCHES-DU-RHONE;PROVENCE-ALPES-COTE-D'AZUR;855100.000000;6261252.000000;2154;5210B;Entreposage et stockage non frigorifique;;
0006700458;BDR THERMEA France ( ex DE DIETRICH);83345721100013;57 RUE DE LA GARE;67580;MERTZWILLER;BAS-RHIN;GRAND-EST;1042931.000000;6873683.000000;2154;2521Z;Fabrication de radiateurs et de chaudières pour le chauffage central;2.(f);Installations de traitement de surface de métaux et des matières plastiques utilisant un procédé électrolytique ou chimique lorsque le volume des cuves affectées au traitement est égal à 30 m3
0007000172;WIENERBERGER SAS;32731228600013;20 Rue de Calonne, BP 3;62260;CAUCHY-A-LA-TOUR;PAS-DE-CALAIS;HAUTS-DE-FRANCE;660845.000000;7044526.000000;2154;0812Z;Exploitation de gravières et sablières, extraction d'argiles et de kaolin;;
0024700115;SMEVOM du Charolais-Brionnais et de l'Au;25710384600040;CET d'Autun, #3779;71400;AUTUN;SAONE-ET-LOIRE;BOURGOGNE-FRANCHE-COMTE;795798.000000;6648478.000000;2154;3811Z;Collecte des déchets non dangereux;5.(d);Décharges, à l'exception des décharges de déchets inertes et des décharges qui ont été définitivement fermées avant le 16 juillet 2001 ou dont la phase de gestion après désaffection requise par les autorités compétentes conformément à l'article 13 de la directive 1999/31/CE du Conseil du 26 avril 1999 concernant la mise en décharge des déchets s'est achevée recevant 10 tonnes par jour ou d'une capacité totale de 25 000 tonnes
0006302311;GEVAL BASSE  BARBONTE;34900806000049;BASSE  BARBONTE;85000;LA ROCHE-SUR-YON;VENDEE;PAYS-DE-LA-LOIRE;366429.000000;6626360.000000;2154;3821Z;Traitement et élimination des déchets non dangereux;5.(d);Décharges, à l'exception des décharges de déchets inertes et des décharges qui ont été définitivement fermées avant le 16 juillet 2001 ou dont la phase de gestion après désaffection requise par les autorités compétentes conformément à l'article 13 de la directive 1999/31/CE du Conseil du 26 avril 1999 concernant la mise en décharge des déchets s'est achevée recevant 10 tonnes par jour ou d'une capacité totale de 25 000 tonnes
00       75100089;SCEA CORBEL;38219856200011;Kerouel;29410;PLEYBER-CHRIST;FINISTERE;BRETAGNE;141218;2407736;27572;0147Z;Élevage de volailles;7.(a).(i);disposant de 40 000 emplacements pour la volaille
0005401194;Etablissement d'Aiserey;42134336900011;;21110;AISEREY;COTE-D'OR;BOURGOGNE-FRANCHE-COMTE;814512.003;2244628.007;27572;158H ;Fabrication de sucre;;
0006600672;SIRAP GEMA;37977982000016;Usine St André BP 17;30210;REMOULINS;GARD;OCCITANIE;826024.000000;6316549.000000;2154;2222Z;Fabrication d'emballages en matières plastiques;;
0006700499;CLEMESSY MOTORS;41906448000017;172  AVENUE ARISTIDE BRIAND;68050;MULHOUSE;HAUT-RHIN;GRAND-EST;1023145.000000;6747353.000000;2154;3314Z;Réparation d'équipements électriques;;
0006702739;SUEZ RV OSIS EST ( ex SANEST);31845599500031;14, rue de Rouen, Port-aux-pétroles;67000;STRASBOURG;BAS-RHIN;GRAND-EST;1053651.000000;6843695.000000;2154;3700Z;Collecte et traitement des eaux usées;5.(a);Installations pour la valorisation ou l'élimination des déchets dangereux recevant 10 tonnes par jour
0006700407;SOCIETE EUROPEENNE DE STOCKAGE D1;30457519400028;28, rue de Rouen;67000;STRASBOURG;BAS-RHIN;GRAND-EST;1054051.000000;6844524.000000;2154;5210B;Entreposage et stockage non frigorifique;;
0005401872;AMORA MAILLE Société Industrielle;31164122900076;;89380;APPOIGNY;YONNE;BOURGOGNE-FRANCHE-COMTE;689012;2320300;27572;1084Z;Fabrication de condiments et assaisonnements;;
0010001574;ELVIA PCB;38950225300047;ZI;45270;BELLEGARDE;LOIRET;CENTRE;658528.000000;6765763.000000;2154;2611Z;Fabrication de composants électroniques;2.(f);Installations de traitement de surface de métaux et des matières plastiques utilisant un procédé électrolytique ou chimique lorsque le volume des cuves affectées au traitement est égal à 30 m3
0007000612;NORZINCO;39781114200033;rue de l'Europe, parc d'activités Europescaut;59410;ANZIN;NORD;HAUTS-DE-FRANCE;683200;2597900;27572;2443Z;Métallurgie du plomb, du zinc ou de l'étain;4.(b).(v);non-métaux, oxydes métalliques ou autres composés inorganiques, tels que carbure de calcium, silicium, carbure de silicium
0007201287;TERREAL;56211034600128;81 rue Nationale;16270;ROUMAZIERES-LOUBERT;CHARENTE;NOUVELLE-AQUITAINE;511925.000000;6534383.000000;2154;2332Z;Fabrication de briques, tuiles et produits de construction, en terre cuite;3.(g);Installations destinées à la fabrication de produits céramiques par cuisson, notamment de tuiles, de briques (simples ou réfractaires), de carrelages, de grès ou de porcelaines d'une capacité de production de 75 tonnes par jour, ou d'une capacité de four de 4 m3 et d'une densité d'enfournement de 300 kg/m3 par four
0007300024;EDF Corse;55208131754213;ANCIENNE RTE DE SARTENE VAZZIO, BP 406;20184;AJACCIO;CORSE-DU-SUD;CORSE;1180220.000000;6109987.000000;2154;3513Z;Distribution d'électricité;1.(c);Centrales thermiques et autres installations de combustion avec un apport thermiques de 50 MW
0007000982;IMPRIMERIE NATIONALE;35297362200082;Rue des Frères Beaumont;59128;FLERS-EN-ESCREBIEUX;NORD;HAUTS-DE-FRANCE;703725.000000;7034263.000000;2154;1812Z;Autre imprimerie (labeur);;
0024900044;COVED_ ISDND de Champigny;34340353101900;lieu dit La Tournelle;89340;CHAMPIGNY;YONNE;BOURGOGNE-FRANCHE-COMTE;3.123067;48.302831;4326;3811Z;Collecte des déchets non dangereux;5.(d);Décharges, à l'exception des décharges de déchets inertes et des décharges qui ont été définitivement fermées avant le 16 juillet 2001 ou dont la phase de gestion après désaffection requise par les autorités compétentes conformément à l'article 13 de la directive 1999/31/CE du Conseil du 26 avril 1999 concernant la mise en décharge des déchets s'est achevée recevant 10 tonnes par jour ou d'une capacité totale de 25 000 tonnes
0006103755;ASTRA PLASTIQUE;64378038000017;Boulevard Napoléon Bullukian;69830;SAINT-GEORGES-DE-RENEINS;RHONE;AUVERGNE-RHONE-ALPES;832945.000000;6552335.000000;2154;2222Z;Fabrication d'emballages en matières plastiques;;
0006401019;ASCOMETAL Fos-sur-Mer;83489559100024;Route du quai minéralier;13270;FOS-SUR-MER;BOUCHES-DU-RHONE;PROVENCE-ALPES-COTE-D'AZUR;849339.000000;6262399.000000;2154;2410Z;Sidérurgie;2.(b);Installations pour la production de fonte ou d'acier (de première ou de seconde fusion), notamment en coulée continue d'une capacité de 2,5 tonnes par heure
0007002731;TOYOTA M.M.F.;42055905600015;Parc d'activités de la Vallée de l'Escaut Sud, BP 16;59264;ONNAING;NORD;HAUTS-DE-FRANCE;743960.000000;7030093.000000;2154;2910Z;Construction de véhicules automobiles;2.(f);Installations de traitement de surface de métaux et des matières plastiques utilisant un procédé électrolytique ou chimique lorsque le volume des cuves affectées au traitement est égal à 30 m3
0007002772;PLASTIC OMNIUM COMPOSITES;30634863200077;ZI des Pres Loribes;59128;FLERS-EN-ESCREBIEUX;NORD;HAUTS-DE-FRANCE;704875.000000;7034012.000000;2154;2932Z;Fabrication d'autres équipements automobiles;;
0007001105;LUNOR Coopérative;78107203800032;PLACE DU JEU DE PAUME;62760;MONDICOURT;PAS-DE-CALAIS;HAUTS-DE-FRANCE;608948;2575300;27572;1039A;Autre transformation et conservation de légumes;;
0006601388;DECHARGE - SUEZ RV MEDI (COL DE LA DONE);71262071500169;RD n°1;66600;CALCE;PYRENEES-ORIENTALES;OCCITANIE;677978.000000;6182111.000000;2154;3811Z;Collecte des déchets non dangereux;5.(d);Décharges, à l'exception des décharges de déchets inertes et des décharges qui ont été définitivement fermées avant le 16 juillet 2001 ou dont la phase de gestion après désaffection requise par les autorités compétentes conformément à l'article 13 de la directive 1999/31/CE du Conseil du 26 avril 1999 concernant la mise en décharge des déchets s'est achevée recevant 10 tonnes par jour ou d'une capacité totale de 25 000 tonnes
0006503493;ENERLAY;52921228400028;ZUP BEL AIR, 7 Avenue Taillevent;78100;SAINT-GERMAIN-EN-LAYE;YVELINES;ILE-DE-FRANCE;631799.000000;6866199.000000;2154;3530Z;Production et distribution de vapeur et d'air conditionné;;
0007000673;ASCOMETAL LES DUNES;83489490900029;Usine des Dunes, Rue des Aciéries;59495;LEFFRINCKOUCKE;NORD;HAUTS-DE-FRANCE;662522.000000;7106617.000000;2154;2410Z;Sidérurgie;2.(b);Installations pour la production de fonte ou d'acier (de première ou de seconde fusion), notamment en coulée continue d'une capacité de 2,5 tonnes par heure
0006501338;H.LAURENT;31800739000061;;77400;LAGNY-SUR-MARNE;SEINE-ET-MARNE;ILE-DE-FRANCE;628269;2431100;27572;285A ;Traitement et revêtement des métaux;;
0010000515;CHIMICOLOR;33083953100010;ZI - Route de Tours;36500;BUZANCAIS;INDRE;CENTRE;578148.000000;6644967.000000;2154;2561Z;Traitement et revêtement des métaux;;
0010000625;STEARINERIE DUBOIS;81652060500014;Route de Creuse, Scoury;36300;CIRON;INDRE;CENTRE;569226.000000;6616336.000000;2154;2014Z;Fabrication d'autres produits chimiques organiques de base;4.(a).(ii);hydrocarbures oxygénés, notamment les alcools, aldéhydes, cétones, acides carboxyliques, esters, acétates, éthers, peroxydes, résines époxydes
0007202617;Séché Eco-Industries;33405518300076;La Ressière;86150;LE VIGEANT;VIENNE;NOUVELLE-AQUITAINE;0.607735;46.238251;4326;3821Z;Traitement et élimination des déchets non dangereux;5.(d);Décharges, à l'exception des décharges de déchets inertes et des décharges qui ont été définitivement fermées avant le 16 juillet 2001 ou dont la phase de gestion après désaffection requise par les autorités compétentes conformément à l'article 13 de la directive 1999/31/CE du Conseil du 26 avril 1999 concernant la mise en décharge des déchets s'est achevée recevant 10 tonnes par jour ou d'une capacité totale de 25 000 tonnes
0010000575;LINAMAR LIGHT METALS / MONTUPET;54205079400073;ZI de La Martinerie, Rue Champollion;36130;DIORS;INDRE;CENTRE;606930.000000;6636343.000000;2154;2453Z;Fonderie de métaux légers;2.(e).(ii);destinées à la fusion, y compris l'alliage, de métaux non ferreux et notamment de produits de récupération (affinage, moulage en fonderie, etc.) d'une capacité de fusion de 4 tonnes par jour pour le plomb et le cadmium ou de 20 tonnes par jour pour tous les autres métaux
0010000889;BRABANT CHIMIE;30926799500038;Rue de la Gare;45490;MIGNERES;LOIRET;CENTRE;672748.000000;6771416.000000;2154;4675Z;Commerce de gros (commerce interentreprises) de produits chimiques;5.(a);Installations pour la valorisation ou l'élimination des déchets dangereux recevant 10 tonnes par jour
0006200462;Hôpitaux de Brabois (CHRU);49750571900011;Rue du Morvan;54500;VANDOEUVRE-LES-NANCY;MEURTHE-ET-MOSELLE;GRAND-EST;6.150533;48.648923;4326;3530Z;Production et distribution de vapeur et d'air conditionné;1.(c);Centrales thermiques et autres installations de combustion avec un apport thermiques de 50 MW
0010000728;BAUGE IMPRIMEUR;63480105400038;2, Avenue Pierre Mendès France;37160;DESCARTES;INDRE-ET-LOIRE;CENTRE;0.684255;46.978239;4326;1812Z;Autre imprimerie (labeur);;
0010000007;SNWM;51363480800010;6 rue Emile Zola;18400;SAINT-FLORENT-SUR-CHER;CHER;CENTRE;642321.000000;6655010.000000;2154;2932Z;Fabrication d'autres équipements automobiles;;
0006700452;DMC SAS;51046940600019;13, rue de Pfastatt, BP 2479;68050;MULHOUSE;HAUT-RHIN;GRAND-EST;1023357.000000;6747668.000000;2154;1399Z;Fabrication d'autres textiles n.c.a.;;
0010000149;CHARTRES METROPOLE TRAITEMENT VALORISATI;84372141600017;La Mare Corbonne, Route de Verneuil;28300;MAINVILLIERS;EURE-ET-LOIR;CENTRE;583960.000000;6819772.000000;2154;3821Z;Traitement et élimination des déchets non dangereux;5.(b);Installations destinées à l'incinération des déchets non dangereux dans le cadre de la directive 2000/76/CE du Parlement européen et du Conseil du 4 décembre 2000 sur l'incinération des déchets d'une capacité de 3 tonnes par heure
0007002336;TT PLAST;34511918400017;Rue des Renardières;62300;LENS;PAS-DE-CALAIS;HAUTS-DE-FRANCE;687705.000000;7039226.000000;2154;2222Z;Fabrication d'emballages en matières plastiques;9.(c);Installations destinées au traitement de surface de matières, d'objets ou de produits à l'aide de solvants organiques, notamment pour les opérations d'apprêt, d'impression, de revêtement, de dégraissage, d'imperméabilisation, de collage, de peinture, de nettoyage ou d'imprégnation d'une capacité de consommation de 150 kg par heures ou 200 tonnes par an
0010000756;ESVRES MATRICAGE;43003253200029;Les Poulineries, 14 Route de Cormery;37320;ESVRES;INDRE-ET-LOIRE;CENTRE;533284.000000;6688960.000000;2154;2550A;Forge, estampage, matriçage ,  métallurgie des poudres;;
0005504461;Unité de dépollution;21350184400079;;35360;MONTAUBAN;ILLE-ET-VILAINE;BRETAGNE;274249;2364756;27572;900A ;Collecte et traitement des eaux usées;;
0005401320;FACOM;32863064500054;;58028;NEVERS;NIEVRE;BOURGOGNE-FRANCHE-COMTE;662475;2220888;27572;286C ;Fabrication d'outillage à main;;
0006701465;ALSAPAN FURNITURE;39221314600039;;67190;DINSHEIM;BAS-RHIN;GRAND-EST;975700;2405899;27572;361G ;Fabrication de meubles meublants;;
0006103896;STLD CHAUFFERIE DE LA DOUA;42131625800027;;69100;VILLEURBANNE;RHONE;AUVERGNE-RHONE-ALPES;797208;2089404;27572;3530Z;Production et distribution de vapeur et d'air conditionné;;
0010001766;DEC  Depôts Electrolytiques et Chimiques;77569239500038;Chemin des Roses;41170;CORMENON;LOIR-ET-CHER;CENTRE;542677.000000;6765441.000000;2154;2561Z;Traitement et revêtement des métaux;2.(f);Installations de traitement de surface de métaux et des matières plastiques utilisant un procédé électrolytique ou chimique lorsque le volume des cuves affectées au traitement est égal à 30 m3
0005500251;Site de Saint-Brieuc;45280710000022;;22000;SAINT-BRIEUC;COTES-D'ARMOR;BRETAGNE;223559;2402714;27572;1013B;Charcuterie;;
0010003878;CIMENTS CALCIA - SITE DE BEFFES;65480068900220;Usine de Beffes;18320;BEFFES;CHER;CENTRE;3.003190;47.081490;4326;2351Z;Fabrication de ciment;3.(c).(i);de clinker (ciment) dans des fours rotatifs d'une capacité de production de 500 tonnes par jour
0010001418;DELPHARM (ex FAMAR);49341440300029;5 avenue de Concyr;45000;ORLEANS;LOIRET;CENTRE;620355.000000;6747775.000000;2154;2120Z;Fabrication de préparations pharmaceutiques;;
0010004382;MALTERIES FRANCO-SUISSE;45650053701511;74, Rue des Alouettes;36100;ISSOUDUN;INDRE;CENTRE;573496;2216677;27572;3530Z;Production et distribution de vapeur et d'air conditionné;;
